{
  "$schema": "https://json-schema.org/draft/2020-12/schema",
  "title": "Agent Done Record",
  "type": "object",
  "additionalProperties": true,
  "required": ["schema_version", "id", "status", "completed_at", "worker_id", "summary", "journal"],
  "properties": {
    "schema_version": { "const": 1 },
    "id": { "type": "string", "minLength": 1 },
    "status": { "enum": ["done", "blocked"] },
    "completed_at": { "type": "string", "format": "date-time" },
    "worker_id": { "type": "string", "minLength": 1 },
    "summary": { "type": "string", "minLength": 1 },
    "journal": { "type": "string", "minLength": 1 },
    "result": {}
  }
}
