{
  "schema_version": 1,
  "id": "ios-runtime-release-20260918-002",
  "status": "done",
  "completed_at": "2026-09-18T01:37:30Z",
  "worker_id": "native-worker-20260918T013304Z",
  "summary": "Подтверждено, что плохой X0 уже приходит в SPTM store block; диагностическая трасса перенесена на caller 0x...0d7d04 commit 3111871, продолжение и supervisor-review поставлены в очередь.",
  "journal": ".agent/journal/ios-runtime-release-20260918-002.md",
  "result": ".agent/reports/ios-runtime-release-20260918-002.md"
}
